{
  "$schema": "http://json-schema.org/draft-04/schema#",
  "description": "An item record",
  "type": "object",
  "properties": {
    "id": {
      "type": "string",
      "description": "Unique ID of the item record"
    },
    "hrid": {
      "type": "string",
      "description": "The human readable ID, also called eye readable ID. A system-assigned sequential alternate ID"
    },
    "holdingsRecordId": {
      "type": "string"
    },
    "formerIds": {
      "type": "array",
      "description": "Previous identifiers assigned to the item",
      "items": {
        "type": "string"
      },
      "uniqueItems": true
    },
    "discoverySuppress": {
      "type": "boolean",
      "description": "Records the fact that the record should not be displayed in a discovery system"
    },
    "accessionNumber": {
      "type": "string",
      "description": "Also called inventar number"
    },
    "barcode": {
      "type": "string"
    },
    "itemLevelCallNumber": {
      "type": "string"
    },
    "itemLevelCallNumberPrefix": {
      "type": "string"
    },
    "itemLevelCallNumberSuffix": {
      "type": "string"
    },
    "itemLevelCallNumberTypeId": {
      "type": "string"
    },
    "volume": {
      "type": "string"
    },
    "enumeration": {
      "type": "string"
    },
    "chronology": {
      "type": "string"
    },
    "yearCaption": {
      "type": "array",
      "items": {
        "type": "string"
      },
      "uniqueItems": true
    },
    "itemIdentifier": {
      "type": "string"
    },
    "copyNumbers": {
      "type": "array",
      "items": {
        "type": "string"
      },
      "uniqueItems": true
    },
    "numberOfPieces": {
      "type": "string"
    },
    "descriptionOfPieces": {
      "type": "string"
    },
    "numberOfMissingPieces": {
      "type": "string"
    },
    "missingPieces": {
      "type": "string"
    },
    "missingPiecesDate": {
      "type": "string"
    },
    "itemDamagedStatusId": {
      "type": "string"
    },
    "itemDamagedStatusDate": {
      "type": "string"
    },
    "notes": {
      "type": "array",
      "description": "Notes about action, copy, binding etc.",
      "items": {
        "type": "object",
        "properties": {
          "itemNoteTypeId": {
            "type": "string",
            "description": "ID of the type of note"
          },
          "note": {
            "type": "string",
            "description": "Text content of the note"
          },
          "staffOnly": {
            "type": "boolean",
            "description": "If true, determines that the note should not be visible for others than staff",
            "default": false
          }
        }
      }
    },
    "circulationNotes": {
      "type": "array",
      "description": "Notes to be displayed in circulation processes",
      "items": {
        "type": "object",
        "properties": {
          "id": {
            "type": "string",
            "description": "The id of the circulation note"
          },
          "noteType": {
            "type": "string",
            "description": "Type of circulation process that the note applies to",
            "enum": ["Check in", "Check out"]
          },
          "note": {
            "type": "string",
            "description": "Text to display"
          },
          "source": {
            "type": "object",
            "description": "The user who added/updated the note. The property is generated by the server and needed to support sorting. Points to /users/{id} resource.",
            "properties": {
              "id": {
                "type": "string",
                "description": "The id of the user who added/updated the note. The user information is generated by the server and needed to support sorting. Points to /users/{id} resource."
              },
              "personal": {
                "type": "object",
                "description": "Personal information about the user",
                "properties": {
                  "lastName": {
                    "description": "The user's last name",
                    "type": "string"
                  },
                  "firstName": {
                    "description": "The user's first name",
                    "type": "string"
                  }
                }
              }
            }
          },
          "date": {
            "type": "string",
            "description": "Date and time the record is added/updated. The property is generated by the server and needed to support sorting."
          },
          "staffOnly": {
            "type": "boolean",
            "default": "Flag to restrict display of this note",
            "default": false
          }
        },
        "additionalProperties": false
      }
    },
    "status": {
      "description": "The status of the item",
      "type": "object",
      "properties": {
        "name": {
          "description": "Name of the status e.g. Available, Checked out, In transit",
          "type": "string"
        },
        "date": {
          "description": "Date of a status",
          "type": "string"
        }
      },
      "additionalProperties": false
    },
    "materialTypeId": {
      "type": "string"
    },
    "permanentLoanTypeId": {
      "type": "string"
    },
    "temporaryLoanTypeId": {
      "type": "string"
    },
    "permanentLocationId": {
      "type": "string"
    },
    "temporaryLocationId": {
      "type": "string"
    },
    "electronicAccess": {
      "type": "array",
      "items": {
        "type": "object",
        "properties": {
          "uri": {
            "type": "string",
            "description": "uniform resource identifier (URI) is a string of characters designed for unambiguous identification of resources"
          },
          "linkText": {
            "type": "string",
            "description": "the value of the MARC tag field 856 2nd indicator, where the values are: no information provided, resource, version of resource, related resource, no display constant generated"
          },
          "materialsSpecification": {
            "type": "string",
            "description": "materials specified is used to specify to what portion or aspect of the resource the electronic location and access information applies (e.g. a portion or subset of the item is electronic, or a related electronic resource is being linked to the record)"
          },
          "publicNote": {
            "type": "string",
            "description": "URL public note to be displayed in the discovery"
          },
          "relationshipId": {
            "type": "string",
            "description": "relationship between the electronic resource at the location identified and the item described in the record as a whole"
          }
        },
        "additionalProperties": false,
        "required": [
          "uri"
        ]
      }
    },
    "inTransitDestinationServicePointId": {
      "description": "Service point an item is intended to be transited to (should only be present when in transit)",
      "type": "string",
      "pattern": "^[a-fA-F0-9]{8}-[a-fA-F0-9]{4}-[a-fA-F0-9]{4}-[a-fA-F0-9]{4}-[a-fA-F0-9]{12}$"
    },
    "statisticalCodeIds": {
      "type": "array",
      "description": "List of statistical code IDs",
      "items": {
        "type": "string"
      },
      "uniqueItems": true
    },
    "purchaseOrderLineIdentifier": {
      "type": "string",
      "description": "ID referencing a remote purchase order object related to this item"
    },
    "tags": {
      "description": "arbitrary tags associated with this item",
      "id": "tags",
      "type": "object",
      "$ref": "raml-util/schemas/tags.schema"
    },
    "metadata": {
      "type": "object",
      "$ref": "raml-util/schemas/metadata.schema",
      "readonly": true
    },
    "holdingsRecord2": {
      "type": "object",
      "folio:$ref": "holdingsrecord.json",
      "readonly": true,
      "folio:isVirtual": true,
      "folio:linkBase": "holdings-storage/holdings",
      "folio:linkFromField": "holdingsRecordId",
      "folio:linkToField": "id",
      "folio:includedElement": "holdingsRecords.0"
    }
  },
  "additionalProperties": false,
  "required": [
    "materialTypeId",
    "permanentLoanTypeId",
    "holdingsRecordId"
  ]
}
