{
  "id": "e9f9bc2f-bad5-4613-9d6c-f55efa5805e7",
  "holdingsRecordId": "684b5dc5-92f6-4db7-b996-b549d88f5e4e",
  "materialTypeId": "615b8413-82d5-4203-aa6e-e37984cb5ac3",
  "permanentLoanTypeId": "a1dc1ce3-d56f-4d8a-b498-d5d674ccc845",
  "status": {
    "name": "Available online"
  },
  "notes": [
    {
      "note": "Print began in 1915. Available in print: Vol. 1 (Jan. 1915)-v. 69, no. 12 (Dec. 1983)."
    }
  ]
}
